Sheet: OECD.Stat export
A1: =DotStatQuery(RC[1]) -> #NAME? | B1: <?xml version="1.0" encoding="utf-16"?><WebTableParameter xmlns:xsd="http://www.w3.org/2001/XMLSchema" xmlns:xsi="http://www.w3.org/2001/XMLSchema-instance" xmlns="http://stats.oecd.org/OECDStatWS/2004/03/01/"><DataTable Code="RS_GBL" HasMetadata="true"><Name LocaleIsoCode="en">Global Revenue Statistics Database</Name><Name LocaleIsoCode="fr">Base de données mondiale des statistiques des recettes publiques</Name><Dimension Code="COU" HasMetadata="false" CommonCode="LOCATION" Display="labels"><Name LocaleIsoCode="en">Country</Name><Name LocaleIsoCode="fr">Pays</Name><Member Code="AUT" HasMetadata="true" HasOnlyUnitMetadata="false" HasChild="0"><Name LocaleIsoCode="en">Austria</Name><Name LocaleIsoCode="fr">Autriche</Name></Member><Member Code="BEL" HasMetadata="true" HasOnlyUnitMetadata="false" HasChild="0"><Name LocaleIsoCode="en">Belgium</Name><Name LocaleIsoCode="fr">Belgique</Name></Member></Dimension><Dimension Code="GOV" HasMetadata="false" Display="labels"><Name LocaleIsoCode="en">Level of government</Name><Name LocaleIsoCode="fr">Niveau d'administration</Name><Member Code="NES" HasMetadata="false" HasOnlyUnitMetadata="false" HasChild="0"><Name LocaleIsoCode="en">Total</Name><Name LocaleIsoCode="fr">Total</Name></Member></Dimension><Dimension Code="TAX" HasMetadata="false" Display="labels"><Name LocaleIsoCode="en">Tax revenue</Name><Name LocaleIsoCode="fr">Recettes fiscales</Name><Member Code="1100" HasMetadata="false" HasOnlyUnitMetadata="false" HasChild="0"><Name LocaleIsoCode="en">1100 Taxes on income, profits and capital gains of individuals</Name><Name LocaleIsoCode="fr">1100 Impôts sur le revenu, les bénéfices et les gains en capital des personnes physiques</Name></Member><Member Code="2000" HasMetadata="false" HasOnlyUnitMetadata="false" HasChild="0"><Name LocaleIsoCode="en">2000 Social security contributions (SSC)</Name><Name LocaleIsoCode="fr">2000 Cotisations de sécurité sociale (CSS)</Name></Member><Member Code="3000" HasMetadata="false" HasOnlyUnitMetadata="false" HasChild="0"><Name LocaleIsoCode="en">3000 Taxes on payroll and workforce</Name><Name LocaleIsoCode="fr">3000 Impôts sur les salaires et la main-d’oeuvre</Name></Member></Dimension><Dimension Code="VAR" HasMetadata="false" Display="labels"><Name LocaleIsoCode="en">Indicator</Name><Name LocaleIsoCode="fr">Indicateur</Name><Member Code="TAXGDP" HasMetadata="true" HasOnlyUnitMetadata="false" HasChild="0"><Name LocaleIsoCode="en">Tax revenue as % of GDP</Name><Name LocaleIsoCode="fr">Recettes fiscales en % du PIB</Name></Member><Member Code="TAXPER" HasMetadata="false" HasOnlyUnitMetadata="false" HasChild="0"><Name LocaleIsoCode="en">Tax revenue as % of total taxation</Name><Name LocaleIsoCode="fr">Recettes fiscales en % du total des recettes</Name></Member></Dimension><Dimension Code="YEA" HasMetadata="false" CommonCode="TIME" Display="labels"><Name LocaleIsoCode="en">Year</Name><Name LocaleIsoCode="fr">Année</Name><Member Code="1990" HasMetadata="false"><Name LocaleIsoCode="en">1990</Name><Name LocaleIsoCode="fr">1990</Name></Member><Member Code="1991" HasMetadata="false"><Name LocaleIsoCode="en">1991</Name><Name LocaleIsoCode="fr">1991</Name></Member><Member Code="1992" HasMetadata="false"><Name LocaleIsoCode="en">1992</Name><Name LocaleIsoCode="fr">1992</Name></Member><Member Code="1993" HasMetadata="false"><Name LocaleIsoCode="en">1993</Name><Name LocaleIsoCode="fr">1993</Name></Member><Member Code="1994" HasMetadata="false"><Name LocaleIsoCode="en">1994</Name><Name LocaleIsoCode="fr">1994</Name></Member><Member Code="1995" HasMetadata="false"><Name LocaleIsoCode="en">1995</Name><Name LocaleIsoCode="fr">1995</Name></Member><Member Code="1996" HasMetadata="false"><Name LocaleIsoCode="en">1996</Name><Name LocaleIsoCode="fr">1996</Name></Member><Member Code="1997" HasMetadata="false"><Name LocaleIsoCode="en">1997</Name><Name LocaleIsoCode="fr">1997</Name></Member><Member Code="1998" HasMetadata="false"><Name LocaleIsoCode="en">1998</Name><Name LocaleIsoCode="fr">1998</Name></Member><Member Code="1999" HasMetadata="false"><Name LocaleIsoCode="en">1999</Name><Name LocaleIsoCode="fr">1999</Name></Member><Member Code="2000" HasMetadata="false"><Name LocaleIsoCode="en">2000</Name><Name LocaleIsoCode="fr">2000</Name></Member><Member Code="2001" HasMetadata="false"><Name LocaleIsoCode="en">2001</Name><Name LocaleIsoCode="fr">2001</Name></Member><Member Code="2002" HasMetadata="false"><Name LocaleIsoCode="en">2002</Name><Name LocaleIsoCode="fr">2002</Name></Member><Member Code="2003" HasMetadata="false"><Name LocaleIsoCode="en">2003</Name><Name LocaleIsoCode="fr">2003</Name></Member><Member Code="2004" HasMetadata="false"><Name LocaleIsoCode="en">2004</Name><Name LocaleIsoCode="fr">2004</Name></Member><Member Code="2005" HasMetadata="false"><Name LocaleIsoCode="en">2005</Name><Name LocaleIsoCode="fr">2005</Name></Member><Member Code="2006" HasMetadata="false"><Name LocaleIsoCode="en">2006</Name><Name LocaleIsoCode="fr">2006</Name></Member><Member Code="2007" HasMetadata="false"><Name LocaleIsoCode="en">2007</Name><Name LocaleIsoCode="fr">2007</Name></Member><Member Code="2008" HasMetadata="false"><Name LocaleIsoCode="en">2008</Name><Name LocaleIsoCode="fr">2008</Name></Member><Member Code="2009" HasMetadata="false"><Name LocaleIsoCode="en">2009</Name><Name LocaleIsoCode="fr">2009</Name></Member><Member Code="2010" HasMetadata="false"><Name LocaleIsoCode="en">2010</Name><Name LocaleIsoCode="fr">2010</Name></Member><Member Code="2011" HasMetadata="false"><Name LocaleIsoCode="en">2011</Name><Name LocaleIsoCode="fr">2011</Name></Member><Member Code="2012" HasMetadata="false"><Name LocaleIsoCode="en">2012</Name><Name LocaleIsoCode="fr">2012</Name></Member><Member Code="2013" HasMetadata="false"><Name LocaleIsoCode="en">2013</Name><Name LocaleIsoCode="fr">2013</Name></Member><Member Code="2014" HasMetadata="false"><Name LocaleIsoCode="en">2014</Name><Name LocaleIsoCode="fr">2014</Name></Member><Member Code="2015" HasMetadata="false"><Name LocaleIsoCode="en">2015</Name><Name LocaleIsoCode="fr">2015</Name></Member><Member Code="2016" HasMetadata="false"><Name LocaleIsoCode="en">2016</Name><Name LocaleIsoCode="fr">2016</Name></Member><Member Code="2017" HasMetadata="false"><Name LocaleIsoCode="en">2017</Name><Name LocaleIsoCode="fr">2017</Name></Member><Member Code="2018" HasMetadata="false"><Name LocaleIsoCode="en">2018</Name><Name LocaleIsoCode="fr">2018</Name></Member><Member Code="2019" HasMetadata="false"><Name LocaleIsoCode="en">2019</Name><Name LocaleIsoCode="fr">2019</Name></Member><Member Code="2020" HasMetadata="false"><Name LocaleIsoCode="en">2020</Name><Name LocaleIsoCode="fr">2020</Name></Member></Dimension><WBOSInformations><TimeDimension WebTreeWasUsed="false"><StartCodes Annual="1990" /></TimeDimension></WBOSInformations><Tabulation Axis="horizontal"><Dimension Code="TAX" /><Dimension Code="VAR" /></Tabulation><Tabulation Axis="vertical"><Dimension Code="COU" /><Dimension Code="YEA" /></Tabulation><Tabulation Axis="page"><Dimension Code="GOV" /></Tabulation><Formatting><Labels LocaleIsoCode="en" /><Power>0</Power><Decimals>1</Decimals><SkipEmptyLines>true</SkipEmptyLines><SkipEmptyCols>false</SkipEmptyCols><SkipLineHierarchy>false</SkipLineHierarchy><SkipColHierarchy>false</SkipColHierarchy><Page>1</Page></Formatting></DataTable><Format><ShowEmptyAxes>true</ShowEmptyAxes><Page>1</Page><EnableSort>true</EnableSort><IncludeFlagColumn>false</IncludeFlagColumn><IncludeTimeSeriesId>false</IncludeTimeSeriesId><DoBarChart>false</DoBarChart><FreezePanes>true</FreezePanes><MaxBarChartLen>65</MaxBarChartLen></Format><Query><AbsoluteUri>http://stats.oecd.org//View.aspx?QueryId=&amp;QueryType=Public&amp;Lang=en</AbsoluteUri></Query></WebTableParameter>
A2: Dataset: Global Revenue Statistics Database
A3: Level of government | D3: Total
A4: Tax revenue | D4: 1100 Taxes on income, profits and capital gains of individuals | F4: 2000 Social security contributions (SSC) | H4: 3000 Taxes on payroll and workforce
A5: Indicator | D5: Tax revenue as % of GDP | E5: Tax revenue as % of total taxation | F5: Tax revenue as % of GDP | G5: Tax revenue as % of total taxation | H5: Tax revenue as % of GDP | I5: Tax revenue as % of total taxation
A6: Country | B6: Year
A7: Austria | B7: 1990 | D7: 8.2342721000000001 | E7: 20.9589833 | F7: 12.913696699999999 | G7: 32.869687999999996 | H7: 2.3695637000000001 | I7: 6.0313340999999996
B8: 1991 | D8: 8.6348801000000002 | E8: 21.723982700000001 | F8: 13.001035 | G8: 32.708533000000003 | H8: 2.3976989 | I8: 6.0322285999999998
B9: 1992 | D9: 8.8756926000000007 | E9: 21.500147999999999 | F9: 13.618687599999999 | G9: 32.989403000000003 | H9: 2.4237901000000002 | I9: 5.8712989999999996
B10: 1993 | D10: 9.0109034000000001 | E10: 21.6151309 | F10: 14.1648101 | G10: 33.978194100000003 | H10: 2.437481 | I10: 5.8469688
B11: 1994 | D11: 8.1889448999999992 | E11: 19.637416099999999 | F11: 14.617702400000001 | G11: 35.0538326 | H11: 2.7258344999999999 | I11: 6.5366596000000001
B12: 1995 | D12: 8.5655362999999998 | E12: 20.754119800000002 | F12: 14.7128023 | G12: 35.648820200000003 | H12: 2.8409319000000002 | I12: 6.8835202000000004
B13: 1996 | D13: 9.0234161999999998 | E13: 21.161452100000002 | F13: 14.739020399999999 | G13: 34.565520100000001 | H13: 2.8034688999999999 | I13: 6.5746133000000002
B14: 1997 | D14: 9.5304398999999993 | E14: 21.9392423 | F14: 14.693116 | G14: 33.823814400000003 | H14: 2.7885637000000001 | I14: 6.4193233000000003
B15: 1998 | D15: 9.6326850000000004 | E15: 22.171315 | F15: 14.608231399999999 | G15: 33.623408099999999 | H15: 2.7664469 | I15: 6.3674628999999996
B16: 1999 | D16: 9.7232231000000002 | E16: 22.564685600000001 | F16: 14.563420600000001 | G16: 33.797332699999998 | H16: 2.7576075000000002 | I16: 6.3995803000000002
B17: 2000 | D17: 9.3114624999999993 | E17: 22.020580599999999 | F17: 14.283326300000001 | G17: 33.778489399999998 | H17: 2.7095395 | I17: 6.4077618000000003 | J17: =RC[-3]+RC[-1] -> 40.186251200000001 | K17: 43.244363999999997 | L17: 47.312047999999997 | M17: 54.589621000000001 | N17: 55.073383 | O17: =SUMPRODUCT(RC[-8],RC[-6])/RC[-5] -> 5.3860339687277152 | P17: =AVERAGE(RC[-9],RC[-7]) -> 20.0931256 | Q17: =AVERAGE(RC[-2],RC[-1]) -> 12.739579784363858
B18: 2001 | D18: 9.9155639999999998 | E18: 22.593959600000002 | F18: 14.243507599999999 | G18: 32.455767000000002 | H18: 2.7199325000000001 | I18: 6.1977357 | J18: =RC[-3]+RC[-1] -> 38.653502700000004 | K18: 42.919429000000001 | L18: 46.910884000000003 | M18: 54.006633000000001 | N18: 54.498928999999997 | O18: =SUMPRODUCT(RC[-8],RC[-6])/RC[-5] -> 5.2039854542543669 | P18: =AVERAGE(RC[-9],RC[-7]) -> 19.326751350000002 | Q18: =AVERAGE(RC[-2],RC[-1]) -> 12.265368402127184
B19: 2002 | D19: 9.6456000999999993 | E19: 22.590665999999999 | F19: 14.0582639 | G19: 32.925431199999998 | H19: 2.7067478 | I19: 6.3393915999999999 | J19: =RC[-3]+RC[-1] -> 39.264822799999997 | K19: 43.155498000000001 | L19: 47.073607000000003 | M19: 54.001700999999997 | N19: 54.495404000000001 | O19: =SUMPRODUCT(RC[-8],RC[-6])/RC[-5] -> 5.3158829479209553 | P19: =AVERAGE(RC[-9],RC[-7]) -> 19.632411399999999 | Q19: =AVERAGE(RC[-2],RC[-1]) -> 12.474147173960477
B20: 2003 | D20: 9.6441469000000009 | E20: 22.740859799999999 | F20: 14.089801400000001 | G20: 33.223695399999997 | H20: 2.6991920999999999 | I20: 6.3646840999999998 | J20: =RC[-3]+RC[-1] -> 39.588379499999995 | K20: 43.600465999999997 | L20: 47.377707999999998 | M20: 55.597749999999998 | N20: 61.122477000000003 | O20: =SUMPRODUCT(RC[-8],RC[-6])/RC[-5] -> 5.3414241382530738 | P20: =AVERAGE(RC[-9],RC[-7]) -> 19.794189749999997 | Q20: =AVERAGE(RC[-2],RC[-1]) -> 12.567806944126536
B21: 2004 | D21: 9.4000000999999997 | E21: 22.4034902 | F21: 14.015207699999999 | G21: 33.403145299999998 | H21: 2.6321444999999999 | I21: 6.2733217000000003 | J21: =RC[-3]+RC[-1] -> 39.676467000000002 | K21: 44.016463999999999 | L21: 48.266145000000002 | M21: 56.051796000000003 | N21: 61.759003999999997 | O21: =SUMPRODUCT(RC[-8],RC[-6])/RC[-5] -> 5.2814348681484917 | P21: =AVERAGE(RC[-9],RC[-7]) -> 19.838233500000001 | Q21: =AVERAGE(RC[-2],RC[-1]) -> 12.559834184074246
B22: 2005 | D22: 8.9593136999999992 | E22: 21.845679700000002 | F22: 13.896841 | G22: 33.8849546 | H22: 2.5875151999999999 | I22: 6.3091917000000004 | J22: =RC[-3]+RC[-1] -> 40.1941463 | K22: 43.335026999999997 | L22: 48.14329 | M22: 57.905521 | N22: 57.905521 | O22: =SUMPRODUCT(RC[-8],RC[-6])/RC[-5] -> 5.3188509769940513 | P22: =AVERAGE(RC[-9],RC[-7]) -> 20.09707315 | Q22: =AVERAGE(RC[-2],RC[-1]) -> 12.707962063497025
B23: 2006 | D23: 8.9633462000000002 | E23: 22.182027600000001 | F23: 13.750375999999999 | G23: 34.028722700000003 | H23: 2.5635173999999998 | I23: 6.3440608999999997 | J23: =RC[-3]+RC[-1] -> 40.372783600000005 | K23: 43.798555999999998 | L23: 48.453854 | M23: 57.905521 | N23: 57.905521 | O23: =SUMPRODUCT(RC[-8],RC[-6])/RC[-5] -> 5.3471737618312849 | P23: =AVERAGE(RC[-9],RC[-7]) -> 20.186391800000003 | Q23: =AVERAGE(RC[-2],RC[-1]) -> 12.766782780915644
B24: 2007 | D24: 9.0642735000000005 | E24: 22.354630100000001 | F24: 13.5408252 | G24: 33.3948593 | H24: 2.5586023 | I24: 6.3101149999999997 | J24: =RC[-3]+RC[-1] -> 39.704974300000003 | K24: 44.221049000000001 | L24: 48.760437000000003 | M24: 57.905521 | N24: 60.763128999999999 | O24: =SUMPRODUCT(RC[-8],RC[-6])/RC[-5] -> 5.3072796622316281 | P24: =AVERAGE(RC[-9],RC[-7]) -> 19.852487150000002 | Q24: =AVERAGE(RC[-2],RC[-1]) -> 12.579883406115815
B25: 2008 | D25: 9.5342503000000001 | E25: 23.034535999999999 | F25: 13.673014 | G25: 33.033696800000001 | H25: 2.6967601000000001 | I25: 6.5153122999999997 | J25: =RC[-3]+RC[-1] -> 39.549009099999999 | K25: 44.534927000000003 | L25: 49.033048000000001 | M25: 57.856565000000003 | N25: 60.717497000000002 | O25: =SUMPRODUCT(RC[-8],RC[-6])/RC[-5] -> 5.4419783446738901 | P25: =AVERAGE(RC[-9],RC[-7]) -> 19.77450455 | Q25: =AVERAGE(RC[-2],RC[-1]) -> 12.608241447336944
B26: 2009 | D26: 9.0790588999999997 | E26: 22.154695700000001 | F26: 14.106313699999999 | G26: 34.422189799999998 | H26: 2.8270857999999999 | I26: 6.8986472000000001 | J26: =RC[-3]+RC[-1] -> 41.320836999999997 | K26: 43.261415 | L26: 47.948742000000003 | M26: 56.910055999999997 | N26: 60.555782000000001 | O26: =SUMPRODUCT(RC[-8],RC[-6])/RC[-5] -> 5.7468957679061194 | P26: =AVERAGE(RC[-9],RC[-7]) -> 20.660418499999999 | Q26: =AVERAGE(RC[-2],RC[-1]) -> 13.203657133953058
B27: 2010 | D27: 9.1579072999999998 | E27: 22.359456099999999 | F27: 13.999060999999999 | G27: 34.179357899999999 | H27: 2.8248905999999998 | I27: 6.8971016000000001 | J27: =RC[-3]+RC[-1] -> 41.076459499999999 | K27: 43.499623 | L27: 48.168771 | M27: 56.910055999999997 | N27: 60.555782000000001 | O27: =SUMPRODUCT(RC[-8],RC[-6])/RC[-5] -> 5.7390171141469155 | P27: =AVERAGE(RC[-9],RC[-7]) -> 20.538229749999999 | Q27: =AVERAGE(RC[-2],RC[-1]) -> 13.138623432073457
B28: 2011 | D28: 9.2045708000000008 | E28: 22.385388200000001 | F28: 13.9776676 | G28: 33.993493000000001 | H28: 2.8232463000000001 | I28: 6.8660958000000001 | J28: =RC[-3]+RC[-1] -> 40.859588799999997 | K28: 43.901277 | L28: 48.539772999999997 | M28: 56.910055999999997 | N28: 60.555782000000001 | O28: =SUMPRODUCT(RC[-8],RC[-6])/RC[-5] -> 5.7123085760136041 | P28: =AVERAGE(RC[-9],RC[-7]) -> 20.429794399999999 | Q28: =AVERAGE(RC[-2],RC[-1]) -> 13.071051488006802
B29: 2012 | D29: 9.5053351999999993 | E29: 22.758174199999999 | F29: 14.0960293 | G29: 33.7494558 | H29: 2.8734926999999999 | I29: 6.8798677000000001 | J29: =RC[-3]+RC[-1] -> 40.629323499999998 | K29: 44.225889000000002 | L29: 48.839612000000002 | M29: 56.910055999999997 | N29: 60.555782000000001 | O29: =SUMPRODUCT(RC[-8],RC[-6])/RC[-5] -> 5.7148820322100047 | P29: =AVERAGE(RC[-9],RC[-7]) -> 20.314661749999999 | Q29: =AVERAGE(RC[-2],RC[-1]) -> 13.014771891105003
B30: 2013 | D30: 9.7169974000000003 | E30: 22.791160399999999 | F30: 14.462474200000001 | G30: 33.9216482 | H30: 2.9295871999999998 | I30: 6.8713294999999999 | J30: =RC[-3]+RC[-1] -> 40.792977700000002 | K30: 44.598469000000001 | L30: 49.183759000000002 | M30: 56.910055999999997 | N30: 60.555782000000001 | O30: =SUMPRODUCT(RC[-8],RC[-6])/RC[-5] -> 5.7138957513582511 | P30: =AVERAGE(RC[-9],RC[-7]) -> 20.396488850000001 | Q30: =AVERAGE(RC[-2],RC[-1]) -> 13.055192300679126
B31: 2014 | D31: 10.0341384 | E31: 23.499599100000001 | F31: 14.500655099999999 | G31: 33.960023999999997 | H31: 2.9354472999999999 | I31: 6.8747144000000002 | J31: =RC[-3]+RC[-1] -> 40.834738399999999 | K31: 44.849600000000002 | L31: 49.415725000000002 | M31: 56.910055999999997 | N31: 60.555782000000001 | O31: =SUMPRODUCT(RC[-8],RC[-6])/RC[-5] -> 5.7173248847639391 | P31: =AVERAGE(RC[-9],RC[-7]) -> 20.4173692 | Q31: =AVERAGE(RC[-2],RC[-1]) -> 13.06734704238197
B32: 2015 | D32: 10.4108898 | E32: 24.140663 | F32: 14.484755699999999 | G32: 33.587100700000001 | H32: 2.9164555000000001 | I32: 6.7626467999999997 | J32: =RC[-3]+RC[-1] -> 40.349747499999999 | K32: 45.065845000000003 | L32: 49.616021000000003 | M32: 56.843212999999999 | N32: 60.494593999999999 | O32: =SUMPRODUCT(RC[-8],RC[-6])/RC[-5] -> 5.6292223159545856 | P32: =AVERAGE(RC[-9],RC[-7]) -> 20.17487375 | Q32: =AVERAGE(RC[-2],RC[-1]) -> 12.902048032977293
B33: 2016 | D33: 9.0183511000000003 | E33: 21.599414899999999 | F33: 14.4927782 | G33: 34.710949499999998 | H33: 2.9083877999999999 | I33: 6.9657384999999996 | J33: =RC[-3]+RC[-1] -> 41.676687999999999 | K33: 42.993997 | L33: 47.331795999999997 | M33: 55.977747000000001 | N33: 59.788820000000001 | O33: =SUMPRODUCT(RC[-8],RC[-6])/RC[-5] -> 5.8015022043907551 | P33: =AVERAGE(RC[-9],RC[-7]) -> 20.838343999999999 | Q33: =AVERAGE(RC[-2],RC[-1]) -> 13.319923102195377
B34: 2017 | D34: 9.0758971000000006 | E34: 21.6758308 | F34: 14.5975815 | G34: 34.863188200000003 | H34: 2.7736383999999998 | I34: 6.6242397000000004 | J34: =RC[-3]+RC[-1] -> 41.4874279 | K34: 43.079611999999997 | L34: 47.420240999999997 | M34: 55.840722 | N34: 59.663657999999998 | O34: =SUMPRODUCT(RC[-8],RC[-6])/RC[-5] -> 5.5665565939558181 | P34: =AVERAGE(RC[-9],RC[-7]) -> 20.74371395 | Q34: =AVERAGE(RC[-2],RC[-1]) -> 13.155135271977908
B35: 2018 | D35: 9.3905717000000006 | E35: 22.229304800000001 | F35: 14.7036167 | G35: 34.806312800000001 | H35: 2.7024645999999999 | I35: 6.3972578999999996 | J35: =RC[-3]+RC[-1] -> 41.2035707 | K35: 43.283026999999997 | L35: 47.618571000000003 | M35: 55.771889000000002 | N35: 59.600783999999997 | O35: =SUMPRODUCT(RC[-8],RC[-6])/RC[-5] -> 5.4040209561175505 | P35: =AVERAGE(RC[-9],RC[-7]) -> 20.60178535 | Q35: =AVERAGE(RC[-2],RC[-1]) -> 13.002903153058774
B36: 2019 | D36: 9.6251847000000001 | E36: 22.606696500000002 | F36: 14.8628768 | G36: 34.9084778 | H36: 2.7106807000000002 | I36: 6.3665830000000003 | J36: =RC[-3]+RC[-1] -> 41.275060799999999 | K36: 43.579655000000002 | L36: 47.904752000000002 | M36: 55.737392 | N36: 59.569273000000003 | O36: =SUMPRODUCT(RC[-8],RC[-6])/RC[-5] -> 5.3845522455864545 | P36: =AVERAGE(RC[-9],RC[-7]) -> 20.637530399999999 | Q36: =AVERAGE(RC[-2],RC[-1]) -> 13.011041322793227
B37: 2020 | D37: 9.3587174999999991 | E37: 22.160334299999999 | F37: 15.533160000000001 | G37: 36.780682599999999 | H37: 2.7542574000000002 | I37: 6.5217552000000003 | J37: =RC[-3]+RC[-1] -> 43.3024378 | Q37: =AVERAGE(RC[-2],RC[-1]) -> #DIV/0!
A38: Belgium | B38: 1990 | D38: 13.249924399999999 | E38: 32.0102318 | F38: 13.7486991 | G38: 33.215212000000001 | H38: 0 | I38: 0 | J38: =RC[-3]+RC[-1] -> 33.215212000000001 | Q38: =AVERAGE(RC[-2],RC[-1]) -> #DIV/0!
B39: 1991 | D39: 13.0312109 | E39: 31.3189362 | F39: 14.272249199999999 | G39: 34.301621400000002 | H39: 0 | I39: 0 | J39: =RC[-3]+RC[-1] -> 34.301621400000002 | Q39: =AVERAGE(RC[-2],RC[-1]) -> #DIV/0!
B40: 1992 | D40: 12.937833299999999 | E40: 31.417685200000001 | F40: 14.4645461 | G40: 35.125089899999999 | H40: 0 | I40: 0 | J40: =RC[-3]+RC[-1] -> 35.125089899999999 | Q40: =AVERAGE(RC[-2],RC[-1]) -> #DIV/0!
B41: 1993 | D41: 13.524340499999999 | E41: 31.7236771 | F41: 14.6791681 | G41: 34.432524700000002 | H41: 0 | I41: 0 | J41: =RC[-3]+RC[-1] -> 34.432524700000002 | Q41: =AVERAGE(RC[-2],RC[-1]) -> #DIV/0!
B42: 1994 | D42: 13.592448299999999 | E42: 31.6745622 | F42: 14.3585966 | G42: 33.4599221 | H42: 0 | I42: 0 | J42: =RC[-3]+RC[-1] -> 33.4599221 | Q42: =AVERAGE(RC[-2],RC[-1]) -> #DIV/0!
B43: 1995 | D43: 13.9967343 | E43: 32.674626699999997 | F43: 14.0383516 | G43: 32.771780200000002 | H43: 0 | I43: 0 | J43: =RC[-3]+RC[-1] -> 32.771780200000002 | Q43: =AVERAGE(RC[-2],RC[-1]) -> #DIV/0!
B44: 1996 | D44: 13.694011400000001 | E44: 31.5884486 | F44: 14.1057954 | G44: 32.538325 | H44: 0 | I44: 0 | J44: =RC[-3]+RC[-1] -> 32.538325 | Q44: =AVERAGE(RC[-2],RC[-1]) -> #DIV/0!
B45: 1997 | D45: 13.927037500000001 | E45: 31.788325700000001 | F45: 13.9272606 | G45: 31.788834900000001 | H45: 0 | I45: 0 | J45: =RC[-3]+RC[-1] -> 31.788834900000001 | Q45: =AVERAGE(RC[-2],RC[-1]) -> #DIV/0!
B46: 1998 | D46: 13.9453057 | E46: 31.3822969 | F46: 13.979137100000001 | G46: 31.458430700000001 | H46: 0 | I46: 0 | J46: =RC[-3]+RC[-1] -> 31.458430700000001 | Q46: =AVERAGE(RC[-2],RC[-1]) -> #DIV/0!
B47: 1999 | D47: 13.585087700000001 | E47: 30.708155999999999 | F47: 13.919332300000001 | G47: 31.463692900000002 | H47: 0 | I47: 0 | J47: =RC[-3]+RC[-1] -> 31.463692900000002 | Q47: =AVERAGE(RC[-2],RC[-1]) -> #DIV/0!
B48: 2000 | D48: 13.7602759 | E48: 31.380821600000001 | F48: 13.508263599999999 | G48: 30.806098200000001 | H48: 0 | I48: 0 | J48: =RC[-3]+RC[-1] -> 30.806098200000001 | Q48: =AVERAGE(RC[-2],RC[-1]) -> #DIV/0!
B49: 2001 | D49: 14.009690000000001 | E49: 32.064963800000001 | F49: 13.6862367 | G49: 31.324653399999999 | H49: 0 | I49: 0 | J49: =RC[-3]+RC[-1] -> 31.324653399999999 | Q49: =AVERAGE(RC[-2],RC[-1]) -> #DIV/0!
B50: 2002 | D50: 13.9970628 | E50: 31.8747604 | F50: 13.907915600000001 | G50: 31.671750299999999 | H50: 0 | I50: 0 | J50: =RC[-3]+RC[-1] -> 31.671750299999999 | Q50: =AVERAGE(RC[-2],RC[-1]) -> #DIV/0!
B51: 2003 | D51: 13.652657400000001 | E51: 31.498512099999999 | F51: 13.803759700000001 | G51: 31.847125399999999 | H51: 0 | I51: 0 | J51: =RC[-3]+RC[-1] -> 31.847125399999999 | Q51: =AVERAGE(RC[-2],RC[-1]) -> #DIV/0!
B52: 2004 | D52: 13.461067399999999 | E52: 30.965456400000001 | F52: 13.5032479 | G52: 31.0624872 | H52: 0 | I52: 0 | J52: =RC[-3]+RC[-1] -> 31.0624872 | Q52: =AVERAGE(RC[-2],RC[-1]) -> #DIV/0!
B53: 2005 | D53: 12.588763399999999 | E53: 29.035027400000001 | F53: 13.3007738 | G53: 30.6772253 | H53: 1.5158999999999999E-3 | I53: 3.4964000000000002E-3 | J53: =RC[-3]+RC[-1] -> 30.680721699999999 | Q53: =AVERAGE(RC[-2],RC[-1]) -> #DIV/0!
B54: 2006 | D54: 12.094085400000001 | E54: 27.983903099999999 | F54: 13.263109699999999 | G54: 30.688850299999999 | H54: 1.9067999999999999E-3 | I54: 4.4121000000000004E-3 | J54: =RC[-3]+RC[-1] -> 30.693262399999998 | Q54: =AVERAGE(RC[-2],RC[-1]) -> #DIV/0!
B55: 2007 | D55: 11.922190499999999 | E55: 27.777879500000001 | F55: 13.3511282 | G55: 31.107205499999999 | H55: 1.6006E-3 | I55: 3.7293000000000001E-3 | J55: =RC[-3]+RC[-1] -> 31.110934799999999 | Q55: =AVERAGE(RC[-2],RC[-1]) -> #DIV/0!
B56: 2008 | D56: 12.390634 | E56: 28.423127900000001 | F56: 13.788671300000001 | G56: 31.630114299999999 | H56: 1.6489E-3 | I56: 3.7824999999999998E-3 | J56: =RC[-3]+RC[-1] -> 31.633896799999999 | Q56: =AVERAGE(RC[-2],RC[-1]) -> #DIV/0!
B57: 2009 | D57: 12.1212401 | E57: 28.387839899999999 | F57: 14.278985199999999 | G57: 33.441260399999997 | H57: 1.7029E-3 | I57: 3.9880999999999996E-3 | J57: =RC[-3]+RC[-1] -> 33.445248499999998 | Q57: =AVERAGE(RC[-2],RC[-1]) -> #DIV/0!
B58: 2010 | D58: 12.1044467 | E58: 28.2276341 | F58: 13.9105816 | G58: 32.439550199999999 | H58: 1.9276E-3 | I58: 4.4952000000000004E-3 | J58: =RC[-3]+RC[-1] -> 32.4440454 | Q58: =AVERAGE(RC[-2],RC[-1]) -> #DIV/0!
B59: 2011 | D59: 12.254161099999999 | E59: 28.165455399999999 | F59: 14.0814719 | G59: 32.365419699999997 | H59: 2.2607999999999999E-3 | I59: 5.1964000000000003E-3 | J59: =RC[-3]+RC[-1] -> 32.370616099999999 | Q59: =AVERAGE(RC[-2],RC[-1]) -> #DIV/0!
B60: 2012 | D60: 12.339285800000001 | E60: 27.8346041 | F60: 14.261343399999999 | G60: 32.170326000000003 | H60: 2.0198E-3 | I60: 4.5561999999999998E-3 | J60: =RC[-3]+RC[-1] -> 32.174882200000006 | Q60: =AVERAGE(RC[-2],RC[-1]) -> #DIV/0!
B61: 2013 | D61: 12.846339800000001 | E61: 28.526268699999999 | F61: 14.338322099999999 | G61: 31.839328200000001 | H61: 2.0108000000000001E-3 | I61: 4.4650999999999996E-3 | J61: =RC[-3]+RC[-1] -> 31.843793300000002 | Q61: =AVERAGE(RC[-2],RC[-1]) -> #DIV/0!
B62: 2014 | D62: 12.884410600000001 | E62: 28.791911500000001 | F62: 14.164127199999999 | G62: 31.651606600000001 | H62: 1.9602999999999999E-3 | I62: 4.3804999999999998E-3 | J62: =RC[-3]+RC[-1] -> 31.655987100000001 | Q62: =AVERAGE(RC[-2],RC[-1]) -> #DIV/0!
B63: 2015 | D63: 12.437803199999999 | E63: 28.194125700000001 | F63: 14.0799863 | G63: 31.916641299999998 | H63: 1.9918000000000002E-3 | I63: 4.5151000000000002E-3 | J63: =RC[-3]+RC[-1] -> 31.921156399999997 | Q63: =AVERAGE(RC[-2],RC[-1]) -> #DIV/0!
B64: 2016 | D64: 11.963138499999999 | E64: 27.636143100000002 | F64: 13.4810699 | G64: 31.1427288 | H64: 1.9298E-3 | I64: 4.4581999999999998E-3 | J64: =RC[-3]+RC[-1] -> 31.147186999999999 | Q64: =AVERAGE(RC[-2],RC[-1]) -> #DIV/0!
B65: 2017 | D65: 11.914411400000001 | E65: 27.203966000000001 | F65: 13.410557600000001 | G65: 30.6200902 | H65: 1.7975999999999999E-3 | I65: 4.1043E-3 | J65: =RC[-3]+RC[-1] -> 30.624194500000002 | Q65: =AVERAGE(RC[-2],RC[-1]) -> #DIV/0!
B66: 2018 | D66: 11.817991900000001 | E66: 26.9692659 | F66: 13.264768699999999 | G66: 30.270885 | H66: 1.5648999999999999E-3 | I66: 3.5712000000000001E-3 | J66: =RC[-3]+RC[-1] -> 30.274456199999999 | Q66: =AVERAGE(RC[-2],RC[-1]) -> #DIV/0!
B67: 2019 | D67: 11.2874967 | E67: 26.615428900000001 | F67: 13.1933015 | G67: 31.1092342 | H67: 1.8818999999999999E-3 | I67: 4.4374000000000002E-3 | J67: =RC[-3]+RC[-1] -> 31.1136716 | Q67: =AVERAGE(RC[-2],RC[-1]) -> #DIV/0!
B68: 2020 | D68: 11.830627 | E68: 27.841027400000002 | F68: 13.591333199999999 | G68: 31.9844993 | H68: 1.0509E-3 | I68: 2.4732000000000001E-3 | J68: =RC[-3]+RC[-1] -> 31.9869725 | Q68: =AVERAGE(RC[-2],RC[-1]) -> #DIV/0!
A69: Data extracted on 28 Mar 2023 17:07 UTC (GMT) from OECD.Stat | J69: =RC[-3]+RC[-1] -> 0 | Q69: =AVERAGE(RC[-2],RC[-1]) -> #DIV/0!